question,answer
What are the hyperparameters of a logistic regression model?,"Ans. Classifier penalty, classifier solver and classifier C are the trainable hyperparameters of a Logistic Regression Classifier. These can be specified exclusively with values in Grid Search to hyper tune a Logistic Classifier."
Name a few hyper-parameters of decision trees?,Ans. The most important features which one can tune in decision trees are:
How to deal with multicollinearity?,Ans. Multi collinearity can be dealt with by the following steps:
What is,Ans. It is a situation in which the variance of a variable is unequal across the range of values of the predictor variable.
Is ARIMA model a good fit for every time series problem?,"Ans. No, ARIMA model is not suitable for every type of time series problem. There are situations where ARMA model and others also come in handy."
How do you deal with the class imbalance in a classification problem?,Ans. Class imbalance can be dealt with in the following ways:
What is the role of cross-validation?,"Ans. Cross-validation is a technique which is used to increase the performance of a machine learning algorithm, where the machine is fed sampled data out of the same data for a few times. The sampling is done so that the dataset is broken into small parts of the equal number of rows, and a random part is chosen as the test set, while all other parts are chosen as train sets."
What is a voting model?,"Ans. A voting model is an ensemble model which combines several classifiers but to produce the final result, in case of a classification-based model, takes into account, the classification of a certain data point of all the models and picks the most vouched/voted/generated option from all the given classes in the target column."
How to deal with very few data samples? Is it possible to make a model out of it?,"Ans. If very few data samples are there, we can make use of oversampling to produce new data points. In this way, we can have new data points."
What are the hyperparameters of an SVM?,"Ans. The gamma value, c value and the type of kernel are the hyperparameters of an SVM model."
What is Pandas Profiling?,Ans. Pandas profiling is a step to find the effective number of usable data. It gives us the statistics of NULL values and the usable values and thus makes variable selection and data selection for building models in the preprocessing phase very effective.
What impact does correlation have on PCA?,Ans. If data is correlated PCA does not work well. Because of the correlation of variables the effective variance of variables decreases. Hence correlated data when used for PCA does not work well.
How is PCA different from LDA?,Ans. PCA is unsupervised. LDA is unsupervised.
What distance metrics can be used in KNN?,Ans. Following distance metrics can be used in KNN.
Which metrics can be used to measure correlation of categorical data?,Ans. Chi square test can be used for doing so. It gives the measure of correlation between categorical predictors.
Which algorithm can be used in value imputation in both categorical and continuous categories of data?,Ans. KNN is the only algorithm that can be used for imputation of both categorical and continuous variables.
When should ridge regression be preferred over lasso?,Ans. We should use ridge regression when we want to use all predictors and not remove any as it reduces the coefficient values but does not nullify them.
Which algorithms can be used for important variable selection?,"Ans. Random Forest, Xgboost and plot variable importance charts can be used for variable selection."
What ensemble technique is used by Random forests?,Ans. Bagging is the technique used by Random Forests. Random forests are a collection of trees which work on sampled data from the original dataset with the final prediction being a voted average of all trees.
What ensemble technique is used by gradient boosting trees?,Ans. Boosting is the technique used by GBM.
If we have a high bias error what does it mean? How to treat it?,Ans. High bias error means that that model we are using is ignoring all the important trends in the model and the model is underfitting.
Which type of sampling is better for a classification model and why?,"Ans. Stratified sampling is better in case of classification problems because it takes into account the balance of classes in train and test sets. The proportion of classes is maintained and hence the model performs better. In case of random sampling of data, the data is divided into two parts without taking into consideration the balance classes in the train and test sets. Hence some classes might be present only in tarin sets or validation sets. Hence the results of the resulting model are poor in this case."
What is a good metric for measuring the level of multicollinearity?,"Ans. VIF or 1/tolerance is a good measure of measuring multicollinearity in models. VIF is the percentage of the variance of a predictor which remains unaffected by other predictors. So higher the VIF value, greater is the multicollinearity amongst the predictors."
When can be a categorical value treated as a continuous variable and what effect does it have when done so?,Ans. A categorical predictor can be treated as a continuous one when the nature of data points it represents is ordinal. If the predictor variable is having ordinal data then it can be treated as continuous and its inclusion in the model increases the performance of the model.
What is the role of maximum likelihood in logistic regression.,Ans. Maximum likelihood equation helps in estimation of most probable values of the estimator’s predictor variable coefficients which produces results which are the most likely or most probable and are quite close to the truth values.
Which distance do we measure in the case of KNN?,Ans. The hamming distance is measured in case of KNN for the determination of nearest neighbours. Kmeans uses euclidean distance.
What is a pipeline?,Ans. A pipeline is a sophisticated way of writing software such that each intended action while building a model can be serialized and the process calls the individual functions for the individual tasks. The tasks are carried out in sequence for a given sequence of data points and the entire process can be run onto n threads by use of composite estimators in scikit learn.
Which sampling technique is most suitable when working with time-series data?,Ans. We can use a custom iterative sampling such that we continuously add samples to the train set. We only should keep in mind that the sample used for validation should be added to the next train sets and a new sample is used for validation.
What are the benefits of pruning?,Ans. Pruning helps in the following:
What is normal distribution?,Ans. The distribution having the below properties is called normal distribution.
What is the 68 per cent rule in normal distribution?,Ans. The normal distribution is a bell-shaped curve. Most of the data points are around the median. Hence approximately 68 per cent of the data is around the median. Since there is no skewness and its bell-shaped.
What is a chi-square test?,Ans. A chi-square determines if a sample data matches a population.
What is a random variable,Ans. A Random Variable is a set of possible values from a random experiment. Example: Tossing a coin: we could get Heads or Tails. Rolling of a dice: we get 6 values
What is the degree of freedom?,Ans. It is the number of independent values or quantities which can be assigned to a statistical distribution. It is used in Hypothesis testing and chi-square test.
Which kind of recommendation system is used by amazon to recommend similar items?,Ans. Amazon uses a collaborative filtering algorithm for the recommendation of similar items. It’s a user to user similarity based mapping of user likeness and susceptibility to buy.
What is a false positive?,Ans. It is a test result which wrongly indicates that a particular condition or attribute is present.
What is a false negative?,Ans. A test result which wrongly indicates that a particular condition or attribute is absent.
What is the error term composed of in regression?,Ans. Error is a sum of bias error+variance error+ irreducible error in regression. Bias and variance error can be reduced but not the irreducible error.
Which performance metric is better R2 or adjusted R2?,Ans. Adjusted R2 because the performance of predictors impacts it. R2 is independent of predictors and shows performance improvement through increase if the number of predictors is increased.
What’s the difference between Type I and Type II error?,"Type I and Type II error in machine learning refers to false values. Type I is equivalent to a False positive while Type II is equivalent to a False negative. In Type I error, a hypothesis which ought to be accepted doesn’t get accepted. Similarly, for Type II error, the hypothesis gets rejected which should have been accepted in the first place."
What do you understand by L1 and L2 regularization?,L2 regularization: It tries to spread error among all the terms. L2 corresponds to a Gaussian prior.
"Which one is better, Naive Bayes Algorithm or Decision Trees?","Although it depends on the problem you are solving, but some general advantages are following:"
What do you mean by the ROC curve?,"Receiver operating characteristics (ROC curve): ROC curve illustrates the diagnostic ability of a binary classifier. It is calculated/created by plotting True Positive against False Positive at various threshold settings. The performance metric of ROC curve is AUC (area under curve). Higher the area under the curve, better the prediction power of the model."
What do you mean by AUC curve?,"AUC (area under curve). Higher the area under the curve, better the prediction power of the model."
What is log likelihood in logistic regression?,"It is the sum of the likelihood residuals. At record level, the natural log of the error (residual) is calculated for each record, multiplied by minus one, and those values are totaled. That total is then used as the basis for deviance (2 x ll) and likelihood (exp(ll))."
How would you evaluate a logistic regression model?,"Model Evaluation is a very important part in any analysis to answer the following questions,"
What are the advantages of SVM algorithms?,SVM algorithms have basically advantages in terms of complexity. First I would like to clear that both Logistic regression as well as SVM can form non linear decision surfaces and can be coupled with the kernel trick. If Logistic regression can be coupled with kernel then why use SVM?
Why does XGBoost perform better than SVM?,First reason is that XGBoos is an ensemble method that uses many trees to make a decision so it gains power by repeating itself.
What is the difference between SVM Rank and SVR (Support Vector Regression)?,One is used for ranking and the other is used for regression.
What is the difference between the normal soft margin SVM and SVM with a linear kernel?,Hard-margin
How is linear classifier relevant to SVM?,"An svm is a type of linear classifier. If you don’t mess with kernels, it’s arguably the most simple type of linear classifier."
What are the advantages of using a naive Bayes for classification?,Binomial Naive Bayes: It assumes that all our features are binary such that they take only two values. Means 0s can represent “word does not occur in the document” and 1s as “word occurs in the document”.
Are Gaussian Naive Bayes the same as binomial Naive Bayes?,Binomial Naive Bayes: It assumes that all our features are binary such that they take only two values. Means 0s can represent “word does not occur in the document” and 1s as “word occurs in the document”.
What is the difference between the Naive Bayes Classifier and the Bayes classifier?,"Naive Bayes assumes conditional independence, P(X|Y, Z)=P(X|Z)"
In what real world applications is Naive Bayes classifier used?,Some of real world examples are as given below
Is naive Bayes supervised or unsupervised?,"First, Naive Bayes is not one algorithm but a family of Algorithms that inherits the following attributes:"
What do you understand by selection bias in Machine Learning?,"Selection bias stands for the bias which was introduced by the selection of individuals, groups or data for doing analysis in a way that the proper randomization is not achieved. It ensures that the sample obtained is not representative of the population intended to be analyzed and sometimes it is referred to as the selection effect. This is the part of distortion of a statistical analysis which results from the method of collecting samples. If you don’t take the selection bias into the account then some conclusions of the study may not be accurate."
What do you understand by Precision and Recall?,"In pattern recognition, The information retrieval and classification in machine learning are part of precision. It is also called as positive predictive value which is the fraction of relevant instances among the retrieved instances."
What Are the Three Stages of Building a Model in Machine Learning?,"To build a model in machine learning, you need to follow few steps:"
How Do You Design an Email Spam Filter in Machine Learning?,"The information gain is based on the decrease in entropy after a dataset is split on an attribute. Constructing a decision tree is all about finding the attribute that returns the highest information gain (i.e., the most homogeneous branches). Step 1: Calculate entropy of the target."
What is the difference between Entropy and Information Gain?,"The information gain is based on the decrease in entropy after a dataset is split on an attribute. Constructing a decision tree is all about finding the attribute that returns the highest information gain (i.e., the most homogeneous branches). Step 1: Calculate entropy of the target."
What are collinearity and multicollinearity?,Collinearity is a linear association between two predictors. Multicollinearity is a situation where two or more predictors are highly linearly related.
What is Kernel SVM?,SVM algorithms have basically advantages in terms of complexity. First I would like to clear that both Logistic regression as well as SVM can form non linear decision surfaces and can be coupled with the kernel trick. If Logistic regression can be coupled with kernel then why use SVM?
What is the process of carrying out a linear regression?,Linear Regression Analysis consists of more than just fitting a linear line through a cloud of data points. It consists of 3 stages–
How do I start a career in machine learning?,"There is no fixed or definitive guide through which you can start your machine learning career. The first step is to understand the basic principles of the subject and learn a few key concepts such as algorithms and data structures, coding capabilities, calculus, linear algebra, statistics. For better data analysis, You should have clear understanding of statistics for Machine Learning. The next step would be to take up an ML course or read the top books for self-learning. You can also work on projects to get a hands-on experience."
What is the best way to learn machine learning?,"Any way that suits your style of learning can be considered as the best way to learn. Different people may enjoy different methods. Some of the common ways would be through taking up basics of machine learning course for free, watching YouTube videos, reading blogs with relevant topics, read books which can help you self-learn."
What degree do you need for machine learning?,Most hiring companies will look for a masters or doctoral degree in the relevant domain. The field of study includes computer science or mathematics. But having the necessary skills even without the degree can help you land a ML job too.
How do you break into machine learning?,"The most common way to get into a machine learning career is to acquire the necessary skills. Learn programming languages such as C, C++, Python, and Java. Gain basic knowledge about various ML algorithms, mathematical knowledge about calculus and statistics. This will help you go a long way."
How difficult is machine learning?,"Machine Learning is a vast concept that contains a lot different aspects. With the right guidance and with consistent hard-work, it may not be very difficult to learn. It definitely requires a lot of time and effort, but if you’re interested in the subject and are willing to learn, it won’t be too difficult."
What is machine learning for beginners?,"Machine Learning for beginners will consist of the basic concepts such as types of Machine Learning (Supervised, Unsupervised, Reinforcement Learning). Each of these types of ML have different algorithms and libraries within them, such as, Classification and Regression. There are various classification algorithms and regression algorithms such as Linear Regression. This would be the first thing you will learn before moving ahead with other concepts."
What level of math is required for machine learning?,"You will need to know statistical concepts, linear algebra, probability, Multivariate Calculus, Optimization. As you go into the more in-depth concepts of ML, you will need more knowledge regarding these topics."
Does machine learning require coding?,Programming is a part of Machine Learning. It is important to know programming languages such as Python.
