question,answer
"Explain the terms Artificial Intelligence (AI), Machine Learning (ML) and Deep Learning?","Artificial Intelligence (AI) is the domain of producing intelligent machines. ML refers to systems that can assimilate from experience (training data) and Deep Learning (DL) states to systems that learn from experience on large data sets. ML can be considered as a subset of AI. Deep Learning (DL) is ML but useful to large data sets. The figure below roughly encapsulates the relation between AI, ML, and DL:"
What are the different types of Learning/ Training models in ML?,ML algorithms can be primarily classified depending on the presence/absence of target variables.
What is the main key difference between supervised and unsupervised machine learning?,There are various means to select important variables from a data set that include the following:
"There are many machine learning algorithms till now. If given a data set, how can one determine which algorithm to be used for that?","Machine Learning algorithm to be used purely depends on the type of data in a given dataset. If data is linear then, we use linear regression. If data shows non-linearity then, the bagging algorithm would do better. If the data is to be analyzed/interpreted for some business purposes then we can use decision trees or SVM. If the dataset consists of images, videos, audios then, neural networks would be helpful to get the solution accurately."
State the differences between causality and correlation?,"Causality applies to situations where one action, say X, causes an outcome, say Y, whereas Correlation is just relating one action (X) to another action(Y) but X does not necessarily cause Y."
We look at machine learning software almost all the time. How do we apply Machine Learning to Hardware?,We have to build ML algorithms in System Verilog which is a Hardware development Language and then program it onto an FPGA to apply Machine Learning to hardware.
Explain One-hot encoding and Label Encoding. How do they affect the dimensionality of the given dataset?,"One-hot encoding is the representation of categorical variables as binary vectors. Label Encoding is converting labels/words into numeric form. Using one-hot encoding increases the dimensionality of the data set. Label encoding doesn’t affect the dimensionality of the data set. One-hot encoding creates a new variable for each level in the variable whereas, in Label encoding, the levels of a variable get encoded as 1 and 0."
"What is Bias, Variance and what do you mean by Bias-Variance Tradeoff?","Both are errors in Machine Learning Algorithms. When the algorithm has limited flexibility to deduce the correct observation from the dataset, it results in bias. On the other hand, variance occurs when the model is extremely sensitive to small fluctuations."
How can we relate standard deviation and variance?,Standard deviation refers to the spread of your data from the mean. Variance is the average degree to which each point differs from the mean i.e. the average of all data points. We can relate Standard deviation and Variance because it is the square root of Variance.
A data set is given to you and it has missing values which spread along 1 standard deviation from the mean. How much of the data would remain untouched?,"It is given that the data is spread across mean that is the data is spread across an average. So, we can presume that it is a normal distribution. In a normal distribution, about 68% of data lies in 1 standard deviation from averages like mean, mode or median. That means about 32% of the data remains uninfluenced by missing values."
Is a high variance in data good or bad?,"Higher variance directly means that the data spread is big and the feature has a variety of data. Usually, high variance in a feature is seen as not so good quality."
"If your dataset is suffering from high variance, how would you handle it?","For datasets with high variance, we could use the bagging algorithm to handle it. Bagging algorithm splits the data into subgroups with sampling replicated from random data. After the data is split, random data is used to create rules using a training algorithm. Then we use polling technique to combine all the predicted outcomes of the model."
"A data set is given to you about utilities fraud detection. You have built aclassifier model and achieved a performance score of 98.5%. Is this a goodmodel? If yes, justify. If not, what can you do about it?","Data set about utilities fraud detection is not balanced enough i.e. imbalanced. In such a data set, accuracy score cannot be the measure of performance as it may only be predict the majority class label correctly but in this case our point of interest is to predict the minority label. But often minorities are treated as noise and ignored. So, there is a high probability of misclassification of the minority label as compared to the majority label. For evaluating the model performance in case of imbalanced data sets, we should use Sensitivity (True Positive rate) or Specificity (True Negative rate) to determine class label wise performance of the classification model. If the minority class label’s performance is not so good, we could do the following:"
Explain the handling of missing or corrupted values in the given dataset.,An easy way to handle missing values or corrupted values is to drop the corresponding rows or columns. If there are too many rows or columns to drop then we consider replacing the missing or corrupted values with some new value.
What is Time series?,"A Time series is a sequence of numerical data points in successive order. It tracks the movement of the chosen data points, over a specified period of time and records the data points at regular intervals. Time series doesn’t require any minimum or maximum time input. Analysts often use Time series to examine data according to their specific requirement."
What is a Box-Cox transformation?,Box-Cox transformation is a power transform which transforms non-normal dependent variables into normal variables as normality is the most common assumption made while using many statistical techniques. It has a lambda parameter which when set to 0 implies that this transform is equivalent to log-transform. It is used for variance stabilization and also to normalize the distribution.
What is the exploding gradient problem while using the back propagation technique?,"When large error gradients accumulate and result in large changes in the neural network weights during training, it is called the exploding gradient problem. The values of weights can become so large as to overflow and result in NaN values. This makes the model unstable and the learning of the model to stall just like the vanishing gradient problem. This is one of the most commonly asked interview questions on machine learning."
Explain the differences between Random Forest and Gradient Boosting machines.,Confusion matrix (also called the error matrix) is a table that is frequently used to illustrate the performance of a classification model i.e. classifier on a set of test data for which the true values are well-known.
What is a confusion matrix and why do you need it?,Confusion matrix (also called the error matrix) is a table that is frequently used to illustrate the performance of a classification model i.e. classifier on a set of test data for which the true values are well-known.
What’s a Fourier transform?,"Fourier Transform is a mathematical technique that transforms any function of time to a function of frequency. Fourier transform is closely related to Fourier series. It takes any time-based pattern for input and calculates the overall cycle offset, rotation speed and strength for all possible cycles. Fourier transform is best applied to waveforms since it has functions of time and space. Once a Fourier transform applied on a waveform, it gets decomposed into a sinusoid."
What do you mean by Associative Rule Mining (ARM)?,Associative Rule Mining is one of the techniques to discover patterns in data like features (dimensions) which occur together and features (dimensions) which are correlated. It is mostly used in Market-based Analysis to find how frequently an itemset occurs in a transaction. Association rules have to satisfy minimum support and minimum confidence at the very same time. Association rule generation generally comprised of two different steps:
What is Marginalisation? Explain the process.,Marginalisation is summing the probability of a random variable X given joint probability distribution of X with other variables. It is an application of the law of total probability.
Explain the phrase “Curse of Dimensionality”.,The Curse of Dimensionality refers to the situation when your data has too many features.
Why is rotation of components so important in Principle Component Analysis (PCA)?,"Rotation in PCA is very important as it maximizes the separation within the variance obtained by all the components because of which interpretation of components would become easier. If the components are not rotated, then we need extended components to describe variance of the components."
Explain the difference between Normalization and Standardization.,Normalization and Standardization are the two very popular methods used for feature scaling.
What is Linear Regression?,"Linear Function can be defined as a Mathematical function on a 2D plane as, Y =Mx +C, where Y is a dependent variable and X is Independent Variable, C is Intercept and M is slope and same can be expressed as Y is a Function of X or Y = F(x)."
What could be the issue when the beta value for a certain variable varies way too much in each subset when regression is run on different subsets of the given dataset?,"Variations in the beta values in every subset implies that the dataset is heterogeneous. To overcome this problem, we can use a different model for each of the dataset’s clustered subsets or a non-parametric model such as decision trees."
What does the term Variance Inflation Factor mean?,Variation Inflation Factor (VIF) is the ratio of the model’s variance to the model’s variance with only one independent variable. VIF gives the estimate of the volume of multicollinearity in a set of many regression variables.
What is Kernel Trick in an SVM Algorithm?,"Kernel Trick is a mathematical function which when applied on data points, can find the region of classification between two different classes. Based on the choice of function, be it linear or radial, which purely depends upon the distribution of data, one can build a classifier."
How do you handle outliers in the data?,"Outlier is an observation in the data set that is far away from other observations in the data set. We can discover outliers using tools and functions like box plot, scatter plot, Z-Score, IQR score etc. and then handle them based on the visualization we have got. To handle outliers, we can cap at some threshold, use transformations to reduce skewness of the data and remove outliers if they are anomalies or errors."
State the limitations of Fixed Basis Function.,"Linear separability in feature space doesn’t imply linear separability in input space. So, Inputs are non-linearly transformed using vectors of basic functions with increased dimensionality. Limitations of Fixed basis functions are:"
Define and explain the concept of Inductive Bias with some examples.,"Inductive Bias is a set of assumptions that humans use to predict outputs given inputs that the learning algorithm has not encountered yet. When we are trying to learn Y from X and the hypothesis space for Y is infinite, we need to reduce the scope by our beliefs/assumptions about the hypothesis space which is also called inductive bias. Through these assumptions, we constrain our hypothesis space and also get the capability to incrementally test and improve on the data using hyper-parameters. Examples:"
Explain the term instance-based learning.,Instance Based Learning is a set of procedures for regression and classification which produce a class label prediction based on resemblance to its nearest neighbors in the training data set. These algorithms just collects all the data and get an answer when required or queried. In simple words they are a set of procedures for solving new problems based on the solutions of already solved problems in the past which are similar to the current problem.
"Define precision, recall and F1 Score?",The metric used to access the performance of the classification model is Confusion Metric. Confusion Metric can be further interpreted with the following terms:-
Plot validation score and training score with data set size on the x-axis and another plot with model complexity on the x-axis.,"For high bias in the models, the performance of the model on the validation data set is similar to the performance on the training data set. For high variance in the models, the performance of the model on the validation set is worse than the performance on the training set."
What is Bayes’ Theorem? State at least 1 use case with respect to the machine learning context?,"Bayes’ Theorem describes the probability of an event, based on prior knowledge of conditions that might be related to the event. For example, if cancer is related to age, then, using Bayes’ theorem, a person’s age can be used to more accurately assess the probability that they have cancer than can be done without the knowledge of the person’s age.Chain rule for Bayesian probability can be used to predict the likelihood of the next word in the sentence."
What is Naive Bayes? Why is it Naive?,Naive Bayes classifiers are a series of classification algorithms that are based on the Bayes theorem. This family of algorithm shares a common principle which treats every pair of features independently while being classified.
Explain how a Naive Bayes Classifier works.,Naive Bayes classifiers are a family of algorithms which are derived from the Bayes theorem of probability. It works on the fundamental assumption that every set of two features that is being classified is independent of each other and every feature makes an equal and independent contribution to the outcome.
What do the terms prior probability and marginal likelihood in context of Naive Bayes theorem mean?,"Prior probability is the percentage of dependent binary variables in the data set. If you are given a dataset and dependent variable is either 1 or 0 and percentage of 1 is 65% and percentage of 0 is 35%. Then, the probability that any new input for that variable of being 1 would be 65%."
Explain the difference between Lasso and Ridge?,"Lasso(L1) and Ridge(L2) are the regularization techniques where we penalize the coefficients to find the optimum solution. In ridge, the penalty function is defined by the sum of the squares of the coefficients and for the Lasso, we penalize the sum of the absolute values of the coefficients. Another type of regularization method is ElasticNet, it is a hybrid penalizing function of both lasso and ridge."
What’s the difference between probability and likelihood?,"Probability is the measure of the likelihood that an event will occur that is, what is the certainty that a specific event will occur? Where-as a likelihood function is a function of parameters within the parameter space that describes the probability of obtaining the observed data.So the fundamental difference is, Probability attaches to possible results; likelihood attaches to hypotheses."
Why would you Prune your tree?,"In the context of data science or AIML, pruning refers to the process of reducing redundant branches of a decision tree. Decision Trees are prone to overfitting, pruning the tree helps to reduce the size and minimizes the chances of overfitting. Pruning involves turning branches of a decision tree into leaf nodes and removing the leaf nodes from the original branch. It serves as a tool to perform the tradeoff."
Model accuracy or Model performance? Which one will you prefer and why?,"This is a trick question, one should first get a clear idea, what is Model Performance? If Performance means speed, then it depends upon the nature of the application, any application related to the real-time scenario will need high speed as an important feature. Example: The best of Search Results will lose its virtue if the Query results do not appear fast."
List the advantages and limitations of the Temporal Difference Learning Method.,Temporal Difference Learning Method is a mix of Monte Carlo method and Dynamic programming method. Some of the advantages of this method include:
How would you handle an imbalanced dataset?,"Sampling Techniques can help with an imbalanced dataset. There are two ways to perform sampling, Under Sample or Over Sampling."
Mention some of the EDA Techniques?,Exploratory Data Analysis (EDA) helps analysts to understand the data better and forms the foundation of better models.
Mention why feature engineering is important in model building and list out some of the techniques used for feature engineering.,"Algorithms necessitate features with some specific characteristics to work appropriately. The data is initially in a raw form. You need to extract features from this data before supplying it to the algorithm. This process is called feature engineering. When you have relevant features, the complexity of the algorithms reduces. Then, even if a non-ideal algorithm is used, results come out to be accurate."
Differentiate between Statistical Modeling and Machine Learning?,"Machine learning models are about making accurate predictions about the situations, like Foot Fall in restaurants, Stock-Price, etc. where-as, Statistical models are designed for inference about the relationships between variables, as What drives the sales in a restaurant, is it food or Ambience."
Differentiate between Boosting and Bagging?,Bagging and Boosting are variants of Ensemble Techniques.
What is the significance of Gamma and Regularization in SVM?,"The gamma defines influence. Low values meaning ‘far’ and high values meaning ‘close’. If gamma is too large, the radius of the area of influence of the support vectors only includes the support vector itself and no amount of regularization with C will be able to prevent overfitting. If gamma is very small, the model is too constrained and cannot capture the complexity of the data."
Define ROC curve work,The graphical representation of the contrast between true positive rates and the false positive rate at various thresholds is known as the ROC curve. It is used as a proxy for the trade-off between true positives vs the false positives.
What is the difference between a generative and discriminative model?,"A generative model learns the different categories of data. On the other hand, a discriminative model will only learn the distinctions between different categories of data. Discriminative models perform much better than the generative models when it comes to classification tasks."
What are hyperparameters and how are they different from parameters?,"A parameter is a variable that is internal to the model and whose value is estimated from the training data. They are often saved as part of the learned model. Examples include weights, biases etc."
What is shattering a set of points? Explain VC dimension.,"In order to shatter a given configuration of points, a classifier must be able to, for all possible assignments of positive and negative for the points, perfectly partition the plane such that positive points are separated from negative points. For a configuration of n points, there are 2n possible assignments of positive or negative."
What are some differences between a linked list and an array?,"Arrays and Linked lists are both used to store linear data of similar types. However, there are a few difference between them."
What is the meshgrid () method and the contourf () method? State some usesof both.,"The meshgrid( ) function in numpy takes two arguments as input : range of x-values in the grid, range of y-values in the grid whereas meshgrid needs to be built before the contourf( ) function in matplotlib is used which takes in many inputs : x-values, y-values, fitting curve (contour line) to be plotted in grid, colours etc."
Describe a hash table.,Hashing is a technique for identifying unique objects from a group of similar objects. Hash functions are large keys converted into small keys in hashing techniques. The values of hash functions are stored in data structures which are known hash table.
List the advantages and disadvantages of using Neural Networks.,Advantages:
You have to train a 12GB dataset using a neural network with a machine which has only 3GB RAM. How would you go about it?,"We can use NumPy arrays to solve this issue. Load all the data into an array. In NumPy, arrays have a property to map the complete dataset without loading it completely in memory. We can pass the index of the array, dividing data into batches, to get the data required and then pass the data into the neural networks. But be careful about keeping the batch size normal."
Write a simple code to binarize data.,Conversion of data into binary values on the basis of certain threshold is known as binarizing of data. Values below the threshold are set to 0 and those above the threshold are set to 1 which is useful for feature engineering.
What is an Array?,"The array is defined as a collection of similar items, stored in a contiguous manner. Arrays is an intuitive concept as the need to group similar objects together arises in our day to day lives. Arrays satisfy the same need. How are they stored in the memory? Arrays consume blocks of data, where each element in the array consumes one unit of memory. The size of the unit depends on the type of data being used. For example, if the data type of elements of the array is int, then 4 bytes of data will be used to store each element. For character data type, 1 byte will be used. This is implementation specific, and the above units may change from computer to computer."
What are the advantages and disadvantages of using an Array?,"Now that we know what arrays are, we shall understand them in detail by solving some interview questions. Before that, let us see the functions that Python as a language provides for arrays, also known as, lists."
What is Lists in Python?,"Lists is an effective data structure provided in python. There are various functionalities associated with the same. Let us consider the scenario where we want to copy a list to another list. If the same operation had to be done in C programming language, we would have to write our own function to implement the same."
"Given an array of integers where each element represents the max number of steps that can be made forward from that element. The task is to find the minimum number of jumps to reach the end of the array (starting from the first element). If an element is 0, then cannot move through that element.","Solution: This problem is famously called as end of array problem. We want to determine the minimum number of jumps required in order to reach the end. The element in the array represents the maximum number of jumps that, that particular element can take."
"Given a string S consisting only ‘a’s and ‘b’s, print the last index of the ‘b’ present in it.","When we have are given a string of a’s and b’s, we can immediately find out the first location of a character occurring. Therefore, to find the last occurrence of a character, we reverse the string and find the first occurrence, which is equivalent to the last occurrence in the original string."
Rotate the elements of an array by d positions to the left.,"There exists a pattern here, that is, the first d elements are being interchanged with last n-d +1 elements. Therefore we can just swap the elements. Correct? What if the size of the array is huge, say 10000 elements. There are chances of memory error, run-time error etc. Therefore, we do it more carefully. We rotate the elements one by one in order to prevent the above errors, in case of large arrays."
Water Trapping Problem,"Given an array arr[] of N non-negative integers which represents the height of blocks at index I, where the width of each block is 1. Compute how much water can be trapped in between blocks after raining."
Explain Eigenvectors and Eigenvalues.,Ans. Linear transformations are helpful to understand using eigenvectors. They find their prime usage in the creation of covariance and correlation matrices in data science.
102.,"Ans. The number of clusters can be determined by finding the silhouette score. Often we aim to get some inferences from data using clustering techniques so that we can have a broader picture of a number of classes being represented by the data. In this case, the silhouette score helps us determine the number of cluster centres to cluster our data along."
What are the performance metrics that can be used to estimate the efficiency of a linear regression model?,Ans. The performance metric that is used in this case is:
What is the default method of splitting in decision trees?,The default method of splitting in decision trees is the Gini Index. Gini Index is the measure of impurity of a particular node.
How is p-value useful?,"Ans. The p-value gives the probability of the null hypothesis is true. It gives us the statistical significance of our results. In other words, p-value determines the confidence of a model in a particular output."
Can logistic regression be used for classes more than 2?,"Ans. No, logistic regression cannot be used for classes more than 2 as it is a binary classifier. For multi-class classification algorithms like Decision Trees, Naïve Bayes’ Classifiers are better suited."
